<?xml version="1.0" encoding="UTF-8"?>
<orders
        xmlns:xsi="http://www.w3.org/2001/XMLSchema-instance"
        xmlns="http://by.example.com/orders"
        xsi:schemaLocation="http://by.example.com/orders orders.xsd">

    <order id="1">
        <products>
            <product id="ID-1">
                <name>Margarita</name>
                <description>Very good classic pizza</description>
                <photo_name>Margarita.jpg</photo_name>
                <price>900</price>
                <product_size>md</product_size>
                <ingredients>
                    <ingredient>Cheese</ingredient>
                    <ingredient>Tomato</ingredient>
                    <ingredient>Bacon</ingredient>
                </ingredients>
            </product>
            <product id="ID-2" product_type="drink">
                <name>Coca-cola</name>
                <description>Classical american drink</description>
                <photo_name>Coca-cola.jpg</photo_name>
                <price>300</price>

                <product_size>sm</product_size>
            </product>
        </products>
        <creation>2020-02-24T09:30:10.5</creation>
        <total_price>1200</total_price>
        <status>waiting</status>
        <payment_type>1</payment_type>
    </order>
    <order id="2">
        <products>
            <product id="ID-3">
                <name>Bacon-and-cheese</name>
                <description>Pizza with bacon and cheese</description>
                <photo_name>Bacon-and-cheese.jpg</photo_name>
                <price>1800</price>
                <product_size>lg</product_size>
                <ingredients>
                    <ingredient>Cheese</ingredient>
                    <ingredient>Mushroom</ingredient>
                    <ingredient>Bacon</ingredient>
                </ingredients>
            </product>
        </products>
        <creation>2020-02-25T09:30:10.5</creation>
        <total_price>1800</total_price>
        <status>waiting</status>
        <payment_type>1</payment_type>
        <delivery_inf>
            <delivery_time>2002-05-30T09:30:10.5</delivery_time>
            <client_name>Jan</client_name>
            <address>Lenina 30, 30</address>
            <phone>+375 29 345 34 34</phone>
            <email>abcd@gmail.com</email>
        </delivery_inf>
    </order>
</orders>